{
  "schemaVersion": "glyph-browser-residual-refiner/v1",
  "id": "coarse-residual-refiner/trajectory-trained-mlp-v1",
  "contentSha256": "4dd14a75c54cf56ca9aef041453f27188f56c24defd599ca87509f9b7fc18861",
  "disposition": "runnable-native-trajectory-trained-reference",
  "architecture": {
    "kind": "explicit-per-pixel-residual-mlp",
    "relationToDiffusion": "independent-artifact-not-unet-layers",
    "inputWidth": 10,
    "outputWidth": 3,
    "parameterCount": 33,
    "operators": [
      "nearest-control-sample",
      "dense",
      "tanh",
      "seeded-hash-noise",
      "masked-residual-add"
    ]
  },
  "inputs": {
    "base": {
      "dtype": "uint8",
      "layout": "HWC",
      "channels": 4,
      "colorSpace": "srgb"
    },
    "control": {
      "contractId": "glyph-control-tensor-contract/mvp-v2",
      "contractSha256": "a1e8600ad64f63b119e2113711b235a3007b28416ae03c38c2440eb6ed1c7a3f",
      "layout": "NCHW",
      "channels": [
        "semantic-red:p2",
        "semantic-green:p3",
        "semantic-blue:p4",
        "depth:p5",
        "normal-x:p6",
        "normal-y:p7",
        "normal-z:p8",
        "shade:p16",
        "coverage:p15"
      ]
    },
    "seed": {
      "dtype": "uint32"
    },
    "strength": {
      "dtype": "float32",
      "range": [
        0,
        1
      ]
    },
    "prompt": {
      "encoding": "fnv1a32-feature-seed-only",
      "maxLength": 500
    }
  },
  "featureOrder": [
    "semantic-red",
    "semantic-green",
    "semantic-blue",
    "depth",
    "normal-x",
    "normal-y",
    "normal-z",
    "shade",
    "coverage",
    "seeded-noise"
  ],
  "weights": [
    [
      -0.16876879494074626,
      -0.04132121711357349,
      -0.050719087881258285,
      1.107261274136813,
      0.7398240835956449,
      -0.6977547180244896,
      -0.41407903307236704,
      -0.4762154356399391,
      -0.1862069270876664,
      0.08129850007336165
    ],
    [
      -0.0842214811583828,
      -0.020350874053773338,
      -0.024942645772246225,
      0.4578005828140292,
      0.7230127720021835,
      -0.46631568115122224,
      -0.4410992398291595,
      -0.40442675165534925,
      -0.09246910752232318,
      -0.06721353544920691
    ],
    [
      -0.5304416612131511,
      -0.13114394484622657,
      -0.16100533434968384,
      3.0590905671859305,
      0.492459219159953,
      -0.6627180389610445,
      -1.0039623105089208,
      0.14492654862018559,
      -0.5871171153703086,
      0.061984666316612695
    ]
  ],
  "bias": [
    2.2872540954785623,
    2.1932561310154863,
    2.065820447577562
  ],
  "output": {
    "kind": "rgb-residual",
    "maximumAbsoluteCorrection8": 48,
    "alphaPolicy": "preserve-base-alpha",
    "coveragePolicy": "control-masked-with-0.12-background-prompt-tint"
  },
  "training": {
    "performed": true,
    "sourceBackend": "native-diffusion-intermediate",
    "nativeManifestContentSha256": "9b5a649904750824fa109a8b388036a9d957799287b6071ee0e3f0cda874c9a6",
    "nativeManifestFileSha256": "cab4e50344625d5cc60cce97e7dcf5ceb8c230f9cd8bb28f6fe259c7d8694ea1",
    "controlTensorSha256": "d73e057270dd33fe6474ec29761b745c82fcf3041beb635b999adadf28c3e215",
    "decodedPreviewSha256": [
      "ee1e18f2f489be5c5018c04ba930d14defd1f96270f5a6a9e1198971ea93b665",
      "8a4a28e22d9e72c1d5dbdf9030bc39a89660cff3221715bf839e1074859eba60",
      "d5d52d5a4cb691f52e54e12d784e249b705c37186c32e4a0442e694230309ea0"
    ],
    "sampleCount": 786432,
    "solver": "deterministic-ridge-normal-equation-with-seed-prior-v1",
    "ridge": 0.001,
    "meanSquaredError": 0.1117662951038348,
    "command": "node research/ascii-image-generation/scripts/train-coarse-refiner.mjs --check",
    "claim": "The 33-parameter browser student is fitted to three actual pinned gpu-4090 native diffusion continuation previews. This is an end-to-end contract demonstration, not a native-reference quality claim."
  }
}
